Title;Excerpt;Tags;Team;Project-URL
Research Cluster: NaturBerlin;NaturBerlin develops products that document and analyze changes in biodiversity in urban and peri-urban areas and forecast their effects.;Research, Research Cluster, Future Plan, Biodiversity, Citizen Science, Society, Climate Change;Dr. Nike Sommerwerk, Dr. Jörg Freyhof;https://www.museumfuernaturkunde.berlin/en/research/research-cluster-naturberlin
Research Cluster: AutoBio;From Museomics to Genomics and Pattern Recognition;Research, Research Infrastructure, Research Cluster, Genomics, Future Plan, Collection, Biodiversity;Dr. Thomas von Rintelen, Prof. Dr. Rudolf Meier;https://www.museumfuernaturkunde.berlin/en/research/research-cluster-autobio
Research Cluster: Early Solar System;Exploring the early solar system through innovative approaches to collection development - meteorites and minerals;Research, Research Infrastructure, Research Cluster, Future Plan, Collection, Impact, Earth Sciences;Prof. Dr. Lutz Hecht, Dr. Ansgar Greshake, Dr. Ralf-Thomas Schmitt;https://www.museumfuernaturkunde.berlin/en/research/research-cluster-early-solar-system
Research Custer: SoundEvolution;In the Anthropocene ecosystems worldwide are changing at great speed.;Research, Research Infrastructure, Research Cluster, Future Plan, Collection, Biodiversity;PD Dr. Mirjam Knörnschild, Dr. Karl-Heinz Frommolt, PD Dr. Frieder Mayer, PD Dr. Mark-Oliver Rödel;https://www.museumfuernaturkunde.berlin/en/research/research-custer-soundevolution
Research Cluster: OpenHeritage;The Open Heritage cluster brings together projects from across the MfN’s research areas;Research, Transfer, Research Cluster, Open Museum, Future Plan, Knowledge Transfer, Science Communication, Collection, Society, Cultural Heritage;Dr. Ina Heumann, Dr. Christiane Quaisser;https://www.museumfuernaturkunde.berlin/en/research/research-cluster-openheritage
"Science communication goals of an interdisciplinary exhibition team using the example of the exhibition project ""Tristan - Berlin bares teeth"".";Within the framework of an interdisciplinary cooperation, an innovative exhibition concept was developed: The fossil skeleton of a T. rex is both exhibition and research object. The science communication goals of exhibition curators and scientists were investigated.;SP3 Society and Nature, Exhibition, Research, Knowledge Transfer, Science Communication, Fossils;Dr. Alexandra Moormann;https://www.museumfuernaturkunde.berlin/en/research/science-communication-goals-interdisciplinary-exhibition-team-using-example-exhibition
"Epistemological Beliefs of Students after a Visit of the Special Exhibition ""Tristan - Berlin bares Teeth”";"Students’ epistemological beliefs - Researchers investigate how the T. rex special exhibition ""Tristan - Berlin bares Teeth” influences students' understanding of the nature of science.";SP3 Society and Nature, Exhibition, Social Innovation Unit, Research, Knowledge Transfer, Science Communication;Dr. Alexandra Moormann;https://www.museumfuernaturkunde.berlin/en/research/epistemological-beliefs-students-after-a-visit-special-exhibition-tristan-berlin-bares
Students’ species knowledge about birds in Berlin;House sparrow or nightingale? Researchers investigate whether students recognize regional bird species by appearance and song.;SP3 Society and Nature, Social Innovation Unit, Research, Knowledge Transfer, Protection of Species, Extinction of Species, Biodiversity, Society;Ulrike Sturm, Dr. Alexandra Moormann, Silke Voigt-Heucke, Dr. Kim Mortega;https://www.museumfuernaturkunde.berlin/en/research/students-species-knowledge-about-birds-berlin
Innovative BROMACKER communication formats for everyone;Unique combination of science and knowledge transfer;Evolutionary Diversity Dynamics, Exhibition, Research, Open Museum, Knowledge Transfer, Science Communication, Collection, Biodiversity, Open Science, Society, Digitalization, Evolution, Fossils, Earth Sciences, Laboratories, Cooperation, Cultural Heritage;Prof. Dr. Jörg Fröbisch, Uwe Moldrzyk, Steffen Bock, Dr. Marylène Danto, Anastasia Voloshina, Prof. Dr. Nadia Fröbisch, Prof. Dr. Johannes Müller, PD Dr. Florian Witzmann, Dr. Jason Dunlop, Eva-Maria Bendel, Luisa Merten;https://www.museumfuernaturkunde.berlin/en/research/innovative-bromacker-communication-formats-everyone
Natural science research on Bromacker;Unique skeleton and trace fossils from the Permian period;Evolutionary Diversity Dynamics, Research, Collection, Biodiversity, Digitalization, Evolution, Fossils, Earth Sciences, Laboratories, Climate Change, Cooperation, Cultural Heritage;Prof. Dr. Jörg Fröbisch, Uwe Moldrzyk, Steffen Bock, Dr. Marylène Danto, Anastasia Voloshina, Prof. Dr. Nadia Fröbisch, Prof. Dr. Johannes Müller, PD Dr. Florian Witzmann, Dr. Jason Dunlop, Eva-Maria Bendel, Dr. Ludwig Luthardt, Luisa Merten;https://www.museumfuernaturkunde.berlin/en/research/natural-science-research-bromacker
About the Bromacker excavation site;Unique fossils in the Thuringian Forest;Evolutionary Diversity Dynamics, Research, Collection, Biodiversity, Evolution, Fossils, Earth Sciences, Cultural Heritage;Prof. Dr. Jörg Fröbisch, Uwe Moldrzyk, Steffen Bock, Dr. Marylène Danto, Anastasia Voloshina, Prof. Dr. Nadia Fröbisch, Prof. Dr. Johannes Müller, PD Dr. Florian Witzmann, Dr. Jason Dunlop, Eva-Maria Bendel, Luisa Merten;https://www.museumfuernaturkunde.berlin/en/research/about-bromacker-excavation-site
BROMACKER: New ways of science communication;BROMACKER: Combination of science and knowledge transfer;Evolutionary Diversity Dynamics, Exhibition, Research, Transfer, Open Museum, Knowledge Transfer, Collection, Biodiversity, Open Science, Society, Digitalization, Evolution, Fossils, Earth Sciences, Laboratories, Cooperation, Cultural Heritage;Prof. Dr. Jörg Fröbisch, Uwe Moldrzyk, Steffen Bock, Dr. Marylène Danto, Anastasia Voloshina, Prof. Dr. Nadia Fröbisch, Prof. Dr. Johannes Müller, PD Dr. Florian Witzmann, Dr. Jason Dunlop, Eva-Maria Bendel, Luisa Merten;https://www.museumfuernaturkunde.berlin/en/research/bromacker-new-ways-science-communication
Proximity despite distance: Social research meets technology;New forms of interpersonal communication in museum spaces (NuForm);SP3 Society and Nature, Exhibition, Research, Open Museum, Knowledge Transfer, Digitalization;Linda Gallé, Uwe Moldrzyk, Dr. Claire Förster, Nadine Kühne;https://www.museumfuernaturkunde.berlin/en/research/proximity-despite-distance-social-research-meets-technology
Research Cluster: Embryology;The E collection of the Museum für Naturkunde Berlin is a globally unique scientific resource.;Research, Research Cluster, Morphology, Future Plan, Collection, Evolution;Prof. Dr. Jörg Fröbisch, Prof. Nadia Fröbisch, Ph.D., Dr. Peter Giere;https://www.museumfuernaturkunde.berlin/en/research/research-cluster-embryology
Guidelines on Dealing with Natural History Collections from Colonial Contexts;Taking current discussions in science, society and politics into account the project aims at developing recommendations and standards for dealing with natural history collections from colonial contexts...;SP2 Collection Future, Research, Politics, Collection;Dr. Ina Heumann, Dr. Katja Kaiser, Katja Kaiser;https://www.museumfuernaturkunde.berlin/en/research/guidelines-dealing-natural-history-collections-colonial-contexts
Colonial Provenances of Nature;The project examines the history of the MfN's mammal collection in the decades between 1880 and 1920. During this period, the collection expanded remarkably in terms of quantity and uniqueness of the material available. This increase was made possible through a context of imperial expansion...;SP2 Collection Future, Collection;Dr. Ina Heumann, Dr. Catarina Madruga;https://www.museumfuernaturkunde.berlin/en/research/colonial-provenances-nature
Model learning using dioramas, VR experiences, and other experiential spaces.;This study examines the extent to which learners' mental models of natural ecosystems, using coral reefs as an example, gradually develop through repeated and varied encounters with dioramas (and other experiential spaces such as VR experiences, aquarium visits).;SP3 Society and Nature, Research, Knowledge Transfer;Dr. Alexandra Moormann;https://www.museumfuernaturkunde.berlin/en/research/model-learning-using-dioramas-vr-experiences-and-other-experiential-spaces.
WissensFluss: The Berlin Panke;WissensFluss Panke - Knowledge Flow Panke - is a participatory project in which we invite schools and  the general public to discover and explore the biodiversity and habitats of a local Berlin river - the Panke.;SP3 Society and Nature, Social Innovation Unit, Citizen Science;;https://www.museumfuernaturkunde.berlin/en/research/wissensfluss-berlin-panke
Berliner Stadtnatur series;With the boxes from the Berliner Stadtnatur series, Berliners can make their way to the parks and green spaces of the capital to find out more about the urban biodiversity. Each box focuses on a different species. In addition to interesting information, we also want to give practical tips on how and;SP3 Society and Nature, Social Innovation Unit;Ulrike Sturm, Martin Tscholl;https://www.museumfuernaturkunde.berlin/en/research/berliner-stadtnatur-series
Evaluation of elementary school students understanding of evolution.;This European Study of Eurositizen.eu aims to understand how elementary school students think regarding evolution of living beings.;SP3 Society and Nature, Exhibition, Social Innovation Unit, Research, Knowledge Transfer, Society, Evolution;Dr. Alexandra Moormann;https://www.museumfuernaturkunde.berlin/en/science/evaluation-of-elementary-school-students-understanding-of-evolution.
Collection discovery;With the Future Plan, the museum drives the sustainable development and disclosure of its collection forward and provides innovative use.;SP2 Collection Future, Research, Research Infrastructure, Transfer, Collections Management, Politics, Collection, Society, Digitalization;Dr. Mareike Petersen, Dr. Frederik Berger, Dr. Anke Hoffmann;https://www.museumfuernaturkunde.berlin/en/research/collection-discovery
E²MeVa – Attitude towards Evolution – Measurements and Validity of Outcomes;In this study on the acceptance  of evolution, various subjects such as museum visitors, school children, and student teachers are surveyed using different international measuring instruments.;SP3 Society and Nature, Exhibition, Social Innovation Unit, Research, Knowledge Transfer, Society, Evolution;Dr. Alexandra Moormann;https://www.museumfuernaturkunde.berlin/en/science/e2meva-attitude-towards-evolution-measurements-and-validity-outcomes
Data Portal;The data portal of the Museum für Naturkunde Berlin provides access to the digitised collection objects. It is in continuous development and will gradually be filled with further entries.;SP2 Collection Future, Research Infrastructure, Open Museum, Collections Management, Collection, Digitalization;Jens Dobberthin, Jasper Funk-Smit, Alexander Buhl;https://www.museumfuernaturkunde.berlin/en/research/data-portal
National Research Data Infrastructure;The Museum für Naturkunde Berlin plays a leading role in sustainable national and international scientific networking. It contributes its competencies to how data can be opened up, linked and made accessible in an innovative way.;SP2 Collection Future, Research, Collection, Biodiversity, Open Science, Society, Cultural Heritage;Dr. Jana Hoffmann, Dr. Christian Bölling, Dr. Frederik Berger, Falko Glöckler, Dr. David Lazarus, Prof. Dr. Tahani Nadim, Dr. Christian Bölling;https://www.museumfuernaturkunde.berlin/en/research/national-research-data-infrastructure
Rocky Pasts?;Natural history collections are primarily comprised of object acquired through donation. The mineral and petrograph collection at the Museum für Naturkunde is no exception and was granted several private collections in the first decades of its establishment.;SP2 Collection Future, Research, Politics, Collection;Dr. Ina Heumann, Dr. Angela Strauß, N.N.;https://www.museumfuernaturkunde.berlin/en/research/rocky-pasts
Digitizing Collections, Prototyping Publics;What might be the potential role of publics within the current digitisation project of the MFN collections?;SP2 Collection Future, Database, Research Data Management, Collection, Digitalization;;https://www.museumfuernaturkunde.berlin/en/research/digitizing-collections-prototyping-publics
Changing Natures. Collecting the Anthropocene Together;Our collection experiment started: Contribute your object and your story at Changing-Natures.org and be part of the collection!;SP3 Society and Nature, Social Innovation Unit, Transfer, Collection, Citizen Science, Society, Digitalization;Elisabeth Heyne, Ulrike Sturm, Paula Sommerer, Julia Tovote;https://www.museumfuernaturkunde.berlin/en/research/changing-natures.-collecting-anthropocene-together
Images of Nature;"The contributions in the series ""Images of Nature"" provide insights into the image collections of the Historical Division.";SP3 Society and Nature, Research, Knowledge Transfer, Science Communication, Collection;Sophia Gräfe;https://www.museumfuernaturkunde.berlin/en/research/images-nature
Lecture series: Animals as objects?;This interdisciplinary and international lecture series examines the role of animals in institutional and infrastructural arrangements, past and present.;SP2 Collection Future, Research, Knowledge Transfer;Mareike Vennen;https://www.museumfuernaturkunde.berlin/en/research/lecture-series-animals-objects
Cliff If Felsen;Cliff if Felsen is a poetry project that explores the poetics and politics of the natural history specimen. It centres around the birds that zoologist Ernst Schäfer and American naturalist Brooke Dolan II collected during their second expedition to Tibet…;SP2 Collection Future, Politics, Knowledge Transfer, Science Communication, Collection, Society;;https://www.museumfuernaturkunde.berlin/en/research/cliff-if-felsen
The Trained Animal;Until today, the popularity of Animal Training since the mid-19th century continues. People are fascinated by the narrative behind this subject …;SP2 Collection Future, Research, Politics, Society;;https://www.museumfuernaturkunde.berlin/en/research/trained-animal
The image collection of Georg August Zenker in the Historical Division;The image collection of Georg August Zenker in the Historical Division;SP2 Collection Future, Research, Research Infrastructure, Collection, Cultural Heritage;;https://www.museumfuernaturkunde.berlin/en/research/image-collection-georg-august-zenker-historical-division
Nature’s Registry;When the Berlin Zoological Museum was establishes in 1810, the collection of specimens just barely managed to fill four rooms in the eastern wing of the city’s new university. By 1820, hundreds of specimens were flowing into the museum’s collection…;SP2 Collection Future, Research, Research Infrastructure, Collections Management, Research Data Management, Collection;;https://www.museumfuernaturkunde.berlin/en/research/natures-registry
Culture as an evolutionary force: Does song learning accelerate speciation in a bat ring species?;Greater sac-winged bats sing in different dialects. Researchers investigate whether these culturally transmitted singing dialects have an effect on species formation.;SP1 Dynamics of Nature, Evolutionary Diversity Dynamics, Research, Morphology, Mammals, Protection of Species, Evolution;Prof. Dr. Mirjam Knörnschild;https://www.museumfuernaturkunde.berlin/en/research/culture-evolutionary-force-does-song-learning-accelerate-speciation-a-bat-ring-species
The estate of Rudolf Mell in the Historical Division;Einer der sich in den Historischen Bild- und Schriftgutsammlungen des Museums befindlichen Nachlässe ist der von Rudolf Mell:;SP2 Collection Future, Research, Research Infrastructure, Collection, Cultural Heritage;;https://www.museumfuernaturkunde.berlin/en/research/estate-rudolf-mell-historical-division
The object collection of the Historical Divison;The following object collections can be found in the archive:;SP2 Collection Future, Research, Research Infrastructure, Collection, Cultural Heritage;;https://www.museumfuernaturkunde.berlin/en/research/object-collection-historical-divison
Image Collections;The following document collections can be found in the archive:;SP2 Collection Future, Research, Research Infrastructure, Collection, Cultural Heritage;;https://www.museumfuernaturkunde.berlin/en/research/image-collections
Document collections;The following document collections can be found in the archive:;SP2 Collection Future, Research, Research Infrastructure, Collection, Cultural Heritage;;https://www.museumfuernaturkunde.berlin/en/research/document-collections
Estate collection;Estates of the following persons can be found in the Historical Image and Document Collections:;SP2 Collection Future, Research, Research Infrastructure, Collection, Cultural Heritage;;https://www.museumfuernaturkunde.berlin/en/research/estate-collection
Records collection – Thematic Overview;The archive's records holdings include (among other things) administrative files, correspondence, documents on staff matters, acquisition of collections and collecting expeditions from the following periods and areas of the museum:;SP2 Collection Future, Research, Research Infrastructure, Collection, Cultural Heritage;;https://www.museumfuernaturkunde.berlin/en/research/records-collection-thematic-overview
Records collection - Chronological Overview;The archive's records holdings include (among other things) administrative files, correspondence, documents on staff matters, acquisition of collections and collecting expeditions from the following periods and areas of the museum:;SP2 Collection Future, Research, Research Infrastructure, Collection, Cultural Heritage;;https://www.museumfuernaturkunde.berlin/en/research/records-collection-chronological-overview
Records collection;"Holding Identifier: S
Archive > records holdings
The records holdings of the archive include (among other things) administrative files, correspondence, documents on staff matters, acquisition of collections, and collecting expeditions since 1810.";SP2 Collection Future, Research, Research Infrastructure, Collection, Cultural Heritage;;https://www.museumfuernaturkunde.berlin/en/research/records-collection
Knowing and Caring for Biodiversity;How do the entanglements of humans, non-humans, and technologies produce specific modes of knowing about environments?;SP2 Collection Future, Research, Transfer, Biodiversity, Citizen Science, Society;;https://www.museumfuernaturkunde.berlin/en/research/knowing-and-caring-biodiversity
Amber forests;Amber as a window to the past: Plant fossils enclosed in amber can be used to reconstruct past vegetation.;SP1 Dynamics of Nature, Evolutionary Diversity Dynamics, Research, Collection, Evolution;Simon Beurel, Dr. Eva-Maria Sadowski;https://www.museumfuernaturkunde.berlin/en/research/amber-forests
Günter Tembrock and the Red Foxes;"The path seemed to be paved for an ambitious research project, when Günter Tembrock received the approval of the German Academy of Sciences at Berlin in 1948 for establishing a new ""Research Centre for Animal Psychology"".";SP2 Collection Future, Research, Mammals, Collection;Sophia Gräfe;https://www.museumfuernaturkunde.berlin/en/research/gunter-tembrock-and-red-foxes
Automated Multisensor Station for Monitoring of Species Diversity (AMMOD);Tracking biodiversity locally over long periods of time requires a great deal of effort. Microphones and computers could relieve researchers of field work.;SP1 Dynamics of Nature, Evolutionary Diversity Dynamics, Research, Biodiversity;Karl-Heinz Frommolt, Dr. Olaf Jahn, Benjamin Werner, Hakan Dogan, Dr. Karl-Heinz Frommolt;https://www.museumfuernaturkunde.berlin/en/research/automated-multisensor-station-monitoring-species-diversity-ammod
Eavesdropping on biodiversity loss;Acoustic recording of animal species in a given area is costly. A sensor system co-developed at the Museum für Naturkunde Berlin can provide reliable data quickly and cost-effectively.;SP1 Dynamics of Nature, Evolutionary Diversity Dynamics, Research, Research Infrastructure, Transfer, Knowledge Transfer, Protection of Species, Biodiversity;Dr. Karl-Heinz Frommolt;https://www.museumfuernaturkunde.berlin/en/research/eavesdropping-biodiversity-loss
Science, together;Citizens are invited to actively participate in scientific research. In a European project, the Museum für Naturkunde Berlin collaborated with partner institutions and Citizen Scientists.;SP3 Society and Nature, Social Innovation Unit, Research, Transfer, Open Museum, Knowledge Transfer, Science Communication, Citizen Science, Society, Cooperation;;https://www.museumfuernaturkunde.berlin/en/research/science-together
Crater chronology;Researchers from the Museum für Naturkunde Berlin reconstruct the evolutionary history of the planets of the solar system from traces on their surfaces.;SP1 Dynamics of Nature, Solar System, Impacts & Meteorites, Research;Prof. Dr. Kai Wünnemann;https://www.museumfuernaturkunde.berlin/en/research/crater-chronology
Protocols of a mass extinction;At the end of the Permian, a large part of Earth's biodiversity disappeared. Researchers from the Museum für Naturkunde Berlin are investigating previously unexplored sites for fossils from this time interval.;SP1 Dynamics of Nature, Evolutionary Diversity Dynamics, Research, Extinction of Species, Fossils, Climate Change;Dr. Dieter Korn;https://www.museumfuernaturkunde.berlin/en/research/protocols-a-mass-extinction
Citizen Science “for our environment”;The Federal Environment Agency examined the costs and benefits of Citizen Science in research projects. The Museum für Naturkunde Berlin provided input.;SP3 Society and Nature, Social Innovation Unit, Research, Politics, Knowledge Transfer, Citizen Science, Society;;https://www.museumfuernaturkunde.berlin/en/research/citizen-science-our-environment
The leaves of the Cretaceous;For a long time only comparatively few representatives of monocotyledonous plants from the Cretaceous period were known. A cabinet in Berlin contained new evidence of the earlier diversity.;SP1 Dynamics of Nature, Evolutionary Diversity Dynamics, Research, Biodiversity, Fossils;;https://www.museumfuernaturkunde.berlin/en/research/leaves-cretaceous
Searching for rainforests in Gondwana;Fossils of typical rainforest plants are older than they are supposed to be according to the theory of the emergence of modern tropical rainforests. A researcher from the Museum für Naturkunde Berlin traces back their origin.;SP1 Dynamics of Nature, Evolutionary Morphology, Research, Fossils, Earth Sciences;;https://www.museumfuernaturkunde.berlin/en/research/searching-rainforests-gondwana
The barnacles of Eastern Indonesia;About 120 years ago, zoologists from the Netherlands investigated barnacles of Eastern Indonesian islands. A researcher from the Museum für Naturkunde Berlin follows their tracks.;Centre for Integrative Biodiversity Discovery, Research, Morphology, Collection, Biodiversity, Cooperation;Dr. Kristina von Rintelen;https://www.museumfuernaturkunde.berlin/en/research/barnacles-eastern-indonesia
Without legs through the ground;Not much was known so far about the still little researched amphisbaenians. Researchers at the Museum für Naturkunde Berlin get to the bottom of their development history.;SP1 Dynamics of Nature, Evolutionary Morphology, Research, Evolution, Genetics;Prof. Dr. Johannes Müller;https://www.museumfuernaturkunde.berlin/en/research/without-legs-through-ground
Selection at work;Adaptation to a new environment can quickly re-shape entire populations. Researchers at the Museum für Naturkunde Berlin are investigating what traces this leaves in the genome.;SP1 Dynamics of Nature, Research, Genomics, Evolution, Genetics;;https://www.museumfuernaturkunde.berlin/en/research/selection-work
Arms Races and trench warfare between host and parasite;Genetic warfare: In their continuous conflict and coevolution, parasites and their host organisms go through phases that leave traces in their genomes.;SP1 Dynamics of Nature, Research, Genomics;;https://www.museumfuernaturkunde.berlin/en/research/arms-races-and-trench-warfare-between-host-and-parasite
Development of the sound repertoire of a babbling bat;Bats are known for their ability to locate prey with calls, not so much for complex songs. Field observations show how juveniles learn to vocalize.;Evolutionary Diversity Dynamics, Research, Mammals, Evolution;;https://www.museumfuernaturkunde.berlin/en/research/development-sound-repertoire-a-babbling-bat
Dicraeosaurus: The story of “M” and “m”;Palaeontologists discovered Dicraeosaurus over 100 years ago, but questions about these sauropod dinosaurs remain. Researchers at the Museum für Naturkunde Berlin investigate the most complete skeleton find;Evolutionary Morphology, Research, Morphology, Evolution, Fossils;Dr. Daniela Schwarz;https://www.museumfuernaturkunde.berlin/en/research/dicraeosaurus-story-m-and-m
Fossil search in the Atbara Valley;The Atbara River in eastern Sudan has created a landscape in which fossil search is particularly productive. Researchers from the Museum für Naturkunde Berlin also find early humans' tools.;Evolutionary Morphology, Research, Morphology, Mammals, Evolution, Fossils, Earth Sciences;Faysal Bibi;https://www.museumfuernaturkunde.berlin/en/research/fossil-search-atbara-valley
