Title;Excerpt;Tags;Team;Project-URL
On foot through Pangaea;Tetrapods were the first vertebrates to claim land habitat. Researchers at the Museum für Naturkunde Berlin trace their paths.;SP1 Dynamics of Nature, Evolutionary Diversity Dynamics, Research, Biodiversity, Evolution, Fossils, Earth Sciences;Prof. Dr. Jörg Fröbisch;https://www.museumfuernaturkunde.berlin/en/research/foot-through-pangaea
How Synapsids took the land;In trees, on the water or underground - many ways of life of today's mammals were developed long before them, when the first vertebrates claimed land habitat.;Evolutionary Diversity Dynamics, Research, Extinction of Species, Evolution, Fossils;Prof. Dr. Jörg Fröbisch;https://www.museumfuernaturkunde.berlin/en/research/how-synapsids-took-land
MEMIN Sub-Project: Projectile-target interaction, melting and vaporization in hypervelocity experiments and natural impactites;In the multidisciplinary MEMIN network, researchers investigate natural craters and conduct experimental laboratory studies and numerical simulations to study impacts of cosmic bodies on Earth.;SP1 Dynamics of Nature, Solar System, Impacts & Meteorites, Research, Impact, Laboratories;Dr. Christopher Hamann, Prof. Dr. Lutz Hecht;https://www.museumfuernaturkunde.berlin/en/research/memin-sub-project-projectile-target-interaction-melting-and-vaporization-hypervelocity
MEMIN Sub-Project: Microscale shock processes in sandstone;Impact craters of cosmic bodies on Earth are sometimes difficult to distinguish from other structures. Experiments show how they can be reliably detected.;SP1 Dynamics of Nature, Solar System, Impacts & Meteorites, Research, Impact, Laboratories;Prof. Dr. Lutz Hecht, Prof. Dr. Kai Wünnemann;https://www.museumfuernaturkunde.berlin/en/research/memin-sub-project-microscale-shock-processes-sandstone
MEMIN Sub-Project: Numerical Modeling of Impact Cratering Processes;Craters testify to past impacts of cosmic bodies on Earth. How they form is investigated with computer simulations, dry foam and one of the largest cannons in the world.;SP1 Dynamics of Nature, Solar System, Impacts & Meteorites, Research, Impact, Laboratories;Prof. Dr. Kai Wünnemann;https://www.museumfuernaturkunde.berlin/en/research/memin-sub-project-numerical-modeling-impact-cratering-processes
Tail wagging, the dinosaur way;Palaeontologists have studied sauropod fossils from the Tendaguru site in Tanzania for more than 100 years. As technology advances, new approaches yield new glimpses of how these animals lived;Evolutionary Morphology, Research, Collection, Digitalization, Evolution, Fossils;;https://www.museumfuernaturkunde.berlin/en/research/tail-wagging-dinosaur-way
Infrastructure for research data;A comprehensive service package makes data management easier for researchers. In a joint project, the Museum für Naturkunde Berlin is working on biodiversity data.;SP2 Collection Future, Research Infrastructure, Transfer, Database, Research Data Management, Digitalization, Cooperation;Dr. Mareike Petersen;https://www.museumfuernaturkunde.berlin/en/research/infrastructure-research-data
Legacies of animal sounds collectors;Thousands of sound recordings testify to the great passion of two animal sounds collectors. Their recordings have been made accessible at the Museum für Naturkunde Berlin.;Evolutionary Diversity Dynamics, SP2 Collection Future, Research Infrastructure, Collection, Digitalization, Laboratories;Karl-Heinz Frommolt, Dr. Karl-Heinz Frommolt;https://www.museumfuernaturkunde.berlin/en/research/legacies-animal-sounds-collectors
"Online documentation of the model project ""Art/Nature"" (2014-18)";"Over a period of four years, the international model project ""Art/Nature. Artistic Interventions at the Museum für Naturkunde Berlin"" opened an experimental space for the interactions between contemporary art, museum practice and natural history research.";SP2 Collection Future, Transfer, Open Museum, Knowledge Transfer;Anita Hermannstädter;https://www.museumfuernaturkunde.berlin/en/research/online-documentation-model-project-art/nature-2014-18
Berlin collects cosmic dust;Largely unnoticed, a constant rain of cosmic particles falls on Berlin. The Museum für Naturkunde Berlin seeks citizen support to recover the cosmic treasures.;Solar System, Impacts & Meteorites, Research, Open Museum, Citizen Science;Prof. Dr. Lutz Hecht;https://www.museumfuernaturkunde.berlin/en/science/berlin-collects-cosmic-dust
Platinum treasure hunt in South Africa;Platinum group metals are in demand as raw materials. A geometallurgical model of the world's most important deposit set out to make mining more efficient.;SP1 Dynamics of Nature, Solar System, Impacts & Meteorites, Research, Earth Sciences;Prof. Dr. Lutz Hecht;https://www.museumfuernaturkunde.berlin/en/research/platinum-treasure-hunt-south-africa
Collection Care Laboratories;Counting scales and measuring teeth: researchers examine specimens in the laboratories of the collection of the Museum für Naturkunde Berlin.;SP2 Collection Future, Research Infrastructure, Morphology, Collections Management, Collection, Laboratories;Edda Aßel, Kristine Kämpf, Frank Tillack;https://www.museumfuernaturkunde.berlin/en/research/collection-care-laboratories
Evolutionary genetics, morphology, and developmental biology of the limbs in vertebrates;The focus of the project lies on the genetic basis of limb development in vertebrates. Of particular interest are morphological pecularities which are releated to ecological specialisation.;Evolutionary Diversity Dynamics, Evolutionary Morphology, Research, Morphology, Evolution, Genetics;;https://www.museumfuernaturkunde.berlin/en/research/evolutionary-genetics-morphology-and-developmental-biology-limbs-vertebrates
Neighbourhood test: Agriculture and conservation;Conventional agriculture uses pesticides, while organic farming limits their use to a minimum. Researchers investigate how this affects the biodiversity of neighbouring nature reserves.;Evolutionary Diversity Dynamics, Research, Mammals, Protection of Species, Biodiversity, Cooperation;Dr. Karl-Heinz Frommolt, Sophie Ewert;https://www.museumfuernaturkunde.berlin/en/research/neighbourhood-test-agriculture-and-conservation
Molecular Genetics Facilities;Where genes start talking: In the Molecular Genetics Facilities of the Museum für Naturkunde, researchers apply advanced analytical methods and technologies to investigate the genetic basis of life.;SP1 Dynamics of Nature, SP2 Collection Future, Research Infrastructure, Genomics, Amphibians, Mammals, Biodiversity, Genetics, Laboratories;Dr. Jörg Plötner, Robert Schreiber, Isabelle Waurick;https://www.museumfuernaturkunde.berlin/en/research/molecular-genetics-facilities
Paleontological preparation laboratories;Präparieren, konservieren und restaurieren: In den paläontologischen Präparationslaboren werden Fossilien für die Sammlung, Forschung und Ausstellungen des Museums für Naturkunde vorbereitet.;SP2 Collection Future, Exhibition, Research Infrastructure, Morphology, Collection, Biodiversity, Evolution, Laboratories;Markus Brinkmann, Marten Schöle, Dr. Daniela Schwarz;https://www.museumfuernaturkunde.berlin/en/research/paleontological-preparation-laboratories
Isotope laboratory;They are atoms of the same element, almost identical chemically, but with different weight nuclei: isotopes tell researchers a lot about the material in which they are.;SP1 Dynamics of Nature, SP2 Collection Future, Research Infrastructure, Evolution, Fossils, Earth Sciences, Laboratories, Climate Change;Prof. Dr. Ulrich Struck;https://www.museumfuernaturkunde.berlin/en/research/isotope-laboratory
Integrated Zoological Research Laboratory;Short distances and clever interior design: The zoological research laboratory offers ideal conditions for multi-method approaches in research.;Centre for Integrative Biodiversity Discovery, Evolutionary Diversity Dynamics, Evolutionary Morphology, Research Infrastructure, Genomics, Morphology, Biodiversity, Evolution, Genetics, Laboratories;;https://www.museumfuernaturkunde.berlin/en/research/integrated-zoological-research-laboratory
High-Performance Computing Cluster;Meteorite impacts, the development of planet Earth and genome investigations: The high-performance computing cluster of the Museum für Naturkunde Berlin processes large amounts of data for complex simulations and analyses.;Evolutionary Diversity Dynamics, Solar System, Impacts & Meteorites, Research Infrastructure, Extinction of Species, Biodiversity, Impact, Evolution, Laboratories;;https://www.museumfuernaturkunde.berlin/en/research/high-performance-computing-cluster
Bioacoustics Laboratory;Communication signals on magnetic tape and bat calls in the ultrasonic range: In the bioacoustics laboratory, researchers from the Museum für Naturkunde Berlin investigate animal sound worlds.;SP2 Collection Future, Research Infrastructure, Collection, Biodiversity, Digitalization, Laboratories;Dr. Karl-Heinz Frommolt;https://www.museumfuernaturkunde.berlin/en/research/bioacoustics-laboratory
Micro-CT Laboratory;The evolution of snake locomotion, sabre-toothed frogs and African antelopes: In the 3D laboratory of the Museum für Naturkunde Berlin collection objects are recorded spatially.;SP1 Dynamics of Nature, SP2 Collection Future, Research Infrastructure, Morphology, Digitalization, Fossils, Laboratories;Kristin Mahlow, Prof. Dr. Johannes Müller;https://www.museumfuernaturkunde.berlin/en/research/micro-ct-laboratory
Useful green tiny ones;Diatoms are widespread today and are an important part of the ecosphere. They began to spread 60 million years ago.;SP1 Dynamics of Nature, Evolutionary Diversity Dynamics, Research, Biodiversity, Fossils, Climate Change;Johan Renaudie;https://www.museumfuernaturkunde.berlin/en/research/useful-green-tiny-ones
Freshwater mollusc biogeography of Wallacea;The biogeography of freshwater molluscs in Wallacea has been influenced significantly by abiotic factors. The colonization of islands was driven by active and passive dispersal as well as vicaricance.;Evolutionary Diversity Dynamics, Research, Morphology, Biodiversity, Evolution, Earth Sciences;Dr. Thomas von Rintelen;https://www.museumfuernaturkunde.berlin/en/research/freshwater-mollusc-biogeography-wallacea
ABCD 3.0 - Ongoing development of a data standard for biodiversity data;Biodiversity data are naturally diverse. A research group is further developing a uniform system that can technically map diversity;SP2 Collection Future, Research Infrastructure, Open Museum, Collections Management, Database, Research Data Management, Collection, Biodiversity, Digitalization, Fossils, Earth Sciences, Cooperation;Dr. Mareike Petersen;https://www.museumfuernaturkunde.berlin/en/research/abcd-3.0-ongoing-development-a-data-standard-biodiversity-data
DiSSCo: A European infrastructure;Distributed System of Scientific Collections;SP2 Collection Future, Research Infrastructure, Open Museum, Collections Management, Database, Research Data Management, Collection, Digitalization;Dr. Mareike Petersen;https://www.museumfuernaturkunde.berlin/en/research/dissco-a-european-infrastructure
Effects of meteorite impacts;If a cosmic object is threatening to impact Earth fast predictions of the consequences will be provided by the usage of a database containing numerous pre-processed models of likely impact scenarios.;SP1 Dynamics of Nature, Solar System, Impacts & Meteorites, Research, Database, Impact;Prof. Dr. Kai Wünnemann;https://www.museumfuernaturkunde.berlin/en/research/effects-meteorite-impacts
Functional cranial morphology of cetaceans;Cranial asymmetry is known in odontocetes that can hear ultrasound and has been linked to the split function of the nasal passage in breathing and vocalization.  Mysticete crania are as symmetric as those of terrestrial artiodactyls and archaeocetes, without significant differences within Mysticeti.;SP1 Dynamics of Nature, Evolutionary Morphology, Research, Morphology, Evolution, Fossils;;https://www.museumfuernaturkunde.berlin/en/research/functional-cranial-morphology-cetaceans
Internal anatomy of ear bones and the evolution of low frequency hearing in baleen whales;Low-frequency hearing limits are connected to longer cochleae and relatively larger cranial widths. Very LF hearing in Mysticeti appeared in the middle Miocene, and mysticete infrasonic hearing had evolved by the late Miocene.;SP1 Dynamics of Nature, Evolutionary Morphology, Research, Morphology, Mammals, Evolution, Fossils;;https://www.museumfuernaturkunde.berlin/en/research/internal-anatomy-ear-bones-and-evolution-low-frequency-hearing-baleen-whales
Geochemical and Microanalytical Laboratories;The bigger picture in the details: Researchers investigate the often tiny traces of geological and cosmic processes in rocks in the geochemical and microanalytical laboratory complex.;Solar System, Impacts & Meteorites, Research, Research Infrastructure, Impact, Fossils, Earth Sciences, Laboratories;Kirsten Born, Dr. Ansgar Greshake, Prof. Dr. Lutz Hecht, Dr. Felix Kaufmann, Hans-Rudolf Knöfler, Kathrin Krahn;https://www.museumfuernaturkunde.berlin/en/research/geochemical-and-microanalytical-laboratories
Cooperations;Research museums such as the Museum für Naturkunde do not work in isolation, but are always part of national and international networks. Networking with other research institutions and policy stakeholders promotes exchange and is the driving force behind innovative research. More about the Memberships of the Museum für Naturkunde Berlin you can find here.;Cooperation;;https://www.museumfuernaturkunde.berlin/en/research/cooperations
Tiny fossil thermometers;Small ostracods provide evidence of climate change 252 million years ago. Researchers are investigating how this is related to the mass extinction of that time.;SP1 Dynamics of Nature, Evolutionary Diversity Dynamics, Research, Extinction of Species, Fossils, Earth Sciences, Climate Change;Dr. Dieter Korn;https://www.museumfuernaturkunde.berlin/en/research/tiny-fossil-thermometers
Update for the Neptune Sandbox;Drilling cores from the deep sea document in extraordinary detail around 100 million years of evolutionary and climatic history of the Earth. Researchers at the Museum für Naturkunde Berlin make the data better available for use.;SP1 Dynamics of Nature, Evolutionary Diversity Dynamics, Research, Research Infrastructure, Database, Fossils, Earth Sciences;Dr. David Lazarus;https://www.museumfuernaturkunde.berlin/en/research/update-neptune-sandbox
Evolution of diversity in large herbivores;Diversity patterns are the result of complex deep-time interactions between bio-abiotic factors. Researchers from the MfN investigate are investigate which factors affected to large herbivorous herbivores during the Cenozoic.;Evolutionary Morphology, Research, Database, Mammals, Extinction of Species, Biodiversity, Evolution;Prof. Dr. Johannes Müller;https://www.museumfuernaturkunde.berlin/en/research/evolution-diversity-large-herbivores
Mustelids on the move;Martens as swimmers, diggers, and climbers: research into  how the muscles and bones of mustelids evolved for different types of locomotion.;SP1 Dynamics of Nature, Evolutionary Morphology, Research, Morphology, Mammals, Evolution, Genetics, Laboratories;;https://www.museumfuernaturkunde.berlin/en/research/mustelids-move
Predicting the future with plankton;Researchers are investigating the relationship between polar oceans in Paleogene, the development of plankton and future climate change.;SP1 Dynamics of Nature, Evolutionary Diversity Dynamics, Research, Biodiversity, Evolution, Fossils, Earth Sciences, Climate Change;Dr. Gayane Asatryan;https://www.museumfuernaturkunde.berlin/en/research/predicting-future-plankton
Caddis fly hunting in the Andes;The Páramo in the high altitudes of the South American Andes is a unique ecosystem. A Colombian-German team is doing research  on the poorly known insect fauna.;Centre for Integrative Biodiversity Discovery, Research, Protection of Species, Collection, Biodiversity;Dr. Wolfram Mey;https://www.museumfuernaturkunde.berlin/en/research/caddis-fly-hunting-andes
African antelopes in the ice age;Climatic changes during the ice age influenced the distribution of antelope species throughout Africa. In the case of the South African bluebuck, a fatal factor came into play at a later stage.;Evolutionary Morphology, Research, Mammals, Collection, Evolution, Genetics;Faysal Bibi;https://www.museumfuernaturkunde.berlin/en/research/african-antelopes-ice-age
Hands-on mineralogy;Geosciences are sometimes neglected at school. Mineralogical cases with colourful educational material bring the subjects back on the desks.;SP3 Society and Nature, Social Innovation Unit, Transfer, Knowledge Transfer, Society, Earth Sciences;Prof. Dr. Lutz Hecht;https://www.museumfuernaturkunde.berlin/en/research/hands-mineralogy
Natural history for beginners;Together with educational institutions from the neighboring district of Wedding, the Museum für Naturkunde Berlin accompanies children and their families on their first museum experiences and nature experiences.;SP3 Society and Nature, Social Innovation Unit, Transfer, Open Museum, Knowledge Transfer, Science Communication, Protection of Species, Biodiversity, Society;Astrid Faber;https://www.museumfuernaturkunde.berlin/en/research/natural-history-beginners
Art/Nature. Artistic Interventions at the Museum für Naturkunde Berlin;Art and natural history have always been interwoven. A joint model project of the Federal Cultural Foundation and the Museum für Naturkunde Berlin creates contemporary points of contact.;SP2 Collection Future, Research, Transfer, Open Museum, Knowledge Transfer, Society, Cultural Heritage;Anita Hermannstädter;https://www.museumfuernaturkunde.berlin/en/research/art/nature.-artistic-interventions-museum-fur-naturkunde-berlin
Supermarket - ErbundGut a Research Project;"+++ The installation was available until 15th of May 2019 +++
ErbundGut - The supermarket in the Museum für Naturkunde";SP3 Society and Nature, Social Innovation Unit, Transfer, Open Museum, Politics, Knowledge Transfer, Science Communication, Society;Julia Diekämper, Dr. Alexandra Moormann;https://www.museumfuernaturkunde.berlin/en/research/supermarket-erbundgut-a-research-project
Knowledge “to go”;Researchers are asked to make their knowledge accessible to society. The Museum für Naturkunde Berlin can look back on a long tradition in this regard, but now addresses knowledge transfer once again.;SP3 Society and Nature, Social Innovation Unit, Research, Transfer, Open Museum, Knowledge Transfer, Science Communication;;https://www.museumfuernaturkunde.berlin/en/research/knowledge-go
Seafood in the Utah desert;Species diversity of marine ecosystems increased dramatically around 470 Million years ago. Richard Hofmann investigates whether competition was a driver of this development.;SP1 Dynamics of Nature, Evolutionary Diversity Dynamics, Research, Biodiversity, Evolution, Fossils, Earth Sciences;;https://www.museumfuernaturkunde.berlin/en/research/seafood-utah-desert
From a Ball of Magma to the Blue Planet;Impacts of cosmic bodies probably melted the young Earth completely. Researchers are investigating how a habitable planet has evolved from this hot phase.;SP1 Dynamics of Nature, Solar System, Impacts & Meteorites, Research, Impact, Earth Sciences;Prof. Dr. Kai Wünnemann;https://www.museumfuernaturkunde.berlin/en/research/a-ball-magma-blue-planet
Lifestyles of mammals;Mammals have adapted to occupy various environments, including the land, the air and the water. But not all evolutionary adaptations are as clearly recognizable as legs, wings or flippers.;SP1 Dynamics of Nature, Evolutionary Morphology, Research, Morphology, Database, Mammals, Biodiversity, Evolution;;https://www.museumfuernaturkunde.berlin/en/research/lifestyles-mammals
Darwin Finches 2.0;Computer models show how species evolve in isolated habitats and how many thousands of years of evolutionary history can be lost if humans arrive.;Evolutionary Diversity Dynamics, Research, Protection of Species, Biodiversity, Evolution;;https://www.museumfuernaturkunde.berlin/en/research/darwin-finches-2.0
A Window on Nature and Art;The natural and man-made objects collected in the Brandenburg-Prussian Kunstkammer are among the oldest surviving items of Berlin’s current museum collections.;SP2 Collection Future;Anita Hermannstädter, Prof. Johannes Vogel, Ph.D.;https://www.museumfuernaturkunde.berlin/en/research/a-window-nature-and-art
Brachiopods can see the light;Already in the 19th century, zoologists noticed up to 16 pigment spots in the front part of certain brachiopod larvae. Since these larvae react to light their pigment spots were assumed to represent eye-like photoreceptors.;SP1 Dynamics of Nature, Evolutionary Morphology, Research, Morphology, Evolution, Genetics, Laboratories;;https://www.museumfuernaturkunde.berlin/en/research/brachiopods-can-see-light
From pig to pig;Domestic pigs were bred from wild boars. Researchers are investigating how they have been genetically and physically altered over the past 100 years, including aspects of contemporary taste.;Evolutionary Diversity Dynamics, Research, Genomics, Morphology, Mammals, Collection, Society, Evolution;PD Dr. Frieder Mayer;https://www.museumfuernaturkunde.berlin/en/research/pig-pig
Opinion Boxes;"Between September 2017 and May 2018, visitors found boxes in front of various objects in the permanent exhibitions, asking for their opinions on ethical issues.
The opinion boxes are temporary exhibition elements in the Museum für Naturkunde Berlin and were conceived as part of a co-design process as part of the third-party funding project Visitor Participation. The construction and development (production of the boxes, programming, insertion and card output module) was carried out in cooperation with the interaction designer Michael Jurisch.";Exhibition, Transfer, Open Museum, Knowledge Transfer, Science Communication, Society;;https://www.museumfuernaturkunde.berlin/en/research/opinion-boxes
Wasp named after magical wand from Harry Potter;In January we presented this new wasp species of the genus Dolichurus to our visitors. It lives in Papua New Guinea and belongs to the family of cockroach wasps. We received numerous name suggestions - from visitors to the exhibitions, but also by e-mail - and selected the 10 most suitable names with a jury. In a second round, our visitors chose the most popular name in the exhibitions: elderus, named after the Elder Wand from the Harry Potter books.;SP3 Society and Nature, Transfer, Open Museum, Knowledge Transfer, Biodiversity, Society;;https://www.museumfuernaturkunde.berlin/en/research/wasp-named-after-magical-wand-harry-potter
Fossil echinoderms;The fossil echinoderm collection comprises 36,000 specimens;SP2 Collection Future, Collection, Evolution, Fossils;Dr. David Ware, Andreas Abele-Rassuly, Dr. Christian Neumann;https://www.museumfuernaturkunde.berlin/en/research/fossil-echinoderms
Fossil bivalves, snails, brachiopods, and sponges;The extensive collection of fossil bivalves, snails, brachiopods and sponges comprises over 340,000 specimens;SP2 Collection Future, Collection, Digitalization, Fossils;Dr. David Ware, Andreas Abele-Rassuly, PD Dr. Martin Aberhan, Sylvia Dietze;https://www.museumfuernaturkunde.berlin/en/research/fossil-bivalves-snails-brachiopods-and-sponges
Fossil arthropods and the amber collection;More than 90,000 specimens make up the systematic collection of fossil arthropods and the adjoined amber collection of the Museum für Naturkunde;SP2 Collection Future, Collection, Evolution, Fossils;Dr. David Ware, Andreas Abele-Rassuly, Emily Eybing, Simon Beurel, Dr. Christian Neumann, Dr. Eva-Maria Sadowski;https://www.museumfuernaturkunde.berlin/en/research/fossil-arthropods-and-amber-collection
Deep time evolution and development of the tetrapod body bauplan;The Integration of paleontological and developmental approaches allows for a study of the interplay of ontogeny and macroevolutionary processes over geologic times scales and tehreby offers new insights and perspectives.;SP1 Dynamics of Nature, Evolutionary Morphology, Research, Morphology, Amphibians, Evolution, Fossils;Vivien Bothe, Prof. Nadia Fröbisch, Ph.D., Christian Mitgutsch, PD Dr. Florian Witzmann;https://www.museumfuernaturkunde.berlin/en/research/deep-time-evolution-and-development-tetrapod-body-bauplan
Animals as Objects;“Animals as Objects. Zoological Gardens and Natural History Museum Berlin, 1810 to 2020” is a cooperative research project funded by the German Federal Ministry of Education and Research between the Museum für Naturkunde Berlin, the Humboldt-University of Berlin and the Berlin Zoo plc.;SP2 Collection Future, Research, Transfer, Open Museum, Mammals, Knowledge Transfer, Science Communication, Society, Cultural Heritage;Dr. Ina Heumann;https://www.museumfuernaturkunde.berlin/en/research/animals-objects
Climbing, Digging, and Swimming Limbs: A Story of Evolving Bone and Muscle;My research uses the mustelids - badgers, martens, otters, and weasels – to under the evolution of adaptations for different locomotor habits.;SP1 Dynamics of Nature, Evolutionary Morphology, Research, Morphology, Mammals, Evolution;;https://www.museumfuernaturkunde.berlin/en/research/climbing-digging-and-swimming-limbs-a-story-evolving-bone-and-muscle
