Title;Excerpt;Tags;Team;Project-URL
Open Working Group “FIND – Women in Natural History”;Anyone visiting the mammal collection at the Museum für Naturkunde will come across a specimen of a musk ox in the corridors with an enlargement of this historical photograph on the wall behind it. But who are the two smiling women photographed sitting on the animal with taxidermied bears in their;SP2 Collection Future, Research, Politics, Knowledge Transfer, Research Data Management, Collection;Dr. Sabine von Mering, Anita Hermannstädter, Sarina Schirmer;https://www.museumfuernaturkunde.berlin/en/science/open-working-group-find-frauen-der-naturkunde
Loans for Exhibitions;Loan Object;SP2 Collection Future, Collections Management;Dr. Meta Friese;https://www.museumfuernaturkunde.berlin/en/research/loans-exhibitions
Sustainable data practices and infrastructures in biodiversity science;"Pollinating insects on a flower
      
            The biodiversity community faces the challenge to evaluate and improve the sustainability of its data practices and infrastructures to ensure that they are future-proof and resource-efficient. An all-round evaluation of sustainability in biodiversity informatics requires to address, alongside financial viability, also the fair use of natural resources required by infrastructure development and maintenance, and the availability of biodiversity data for all interested stakeholders, irrespective of constraints such as economic resources or location.";SP2 Collection Future, Research Data Management;Dr. Mareike Petersen;https://www.museumfuernaturkunde.berlin/en/research/sustainable-data-practices-and-infrastructures-biodiversity-science
“Trust in Citizen Science” - Research on trust in citizen science;Science opens up to society: research on trust in citizen science at the Museum für Naturkunde Berlin.;SP3 Society and Nature, Research, Science Communication, Citizen Science;Dr. Susanne Hecker, Silke Voigt-Heucke, Jakob Meyer, Jakob Meyer;https://www.museumfuernaturkunde.berlin/en/research/trust-citizen-science-research-trust-citizen-science
Vielfalt Verstehen – Natur erforschen und erleben (Understanding Diversity);Vielfalt Verstehen is a joint research and education project that focuses on biodiversity in Berlin.;SP1 Dynamics of Nature, SP3 Society and Nature, Open Museum, Knowledge Transfer, Biodiversity, Citizen Science;Astrid Faber, Nike Sommerwerk, Jörg Freyhof, Silvia Keinath, Melina Fienitz, Ronja Velder, Kim Mortega, Frederic Griesbaum, Julia Kissel, Louisa Ramke;https://www.museumfuernaturkunde.berlin/en/research/vielfalt-verstehen-natur-erforschen-und-erleben-understanding-diversity
WiNoDa;In the project WiNoDa (Knowledge Laboratory for Natural Science Collections and Object-Related Data), a data competence center is being developed that focuses on research of natural science collections.;SP2 Collection Future, Research Infrastructure, Database, Research Data Management, Digitalization;Dr. Alex Miklashevsky, Cora Albrecht, Dr. Karolin Heinle, Katja Loginova, Dr. Mareike Petersen;https://www.museumfuernaturkunde.berlin/en/research/winoda
ELIO - development laboratory for innovation in object digitization;innovation in object digitization;SP2 Collection Future;Dr. Frederik Berger, Lisa Pfeiffer, Jakob Müller, Margot Belot, Bernhard Schurian, Romy Campe;https://www.museumfuernaturkunde.berlin/en/research/elio-development-laboratory-innovation-object-digitization
BioDivHubs - Biodiversity in the neighborhood;The garden grows into the neighborhood.;Social Innovation Unit, Biodiversity, Society;Susan Karlebowski, Ulrike Sturm;https://www.museumfuernaturkunde.berlin/en/research/biodivhubs-biodiversity-neighborhood
"Creating opportunities in Berlin:  Educational ecosystem ""Museum in school""";The aim of the project is to firmly anchor the museum in school structures as an innovative extracurricular learning location.;SP3 Society and Nature, Knowledge Transfer, Society, Cooperation;Dr. Alexandra Moormann, Aria Tilove;https://www.museumfuernaturkunde.berlin/en/research/creating-opportunities-berlin-educational-ecosystem-museum-school
Human-nature relationships in the Anthropocene;Inter- and transdisciplinary research on the interplay between humans, nature and digital transformation;Social Innovation Unit;Ulrike Sturm, Johannes Ebbighausen, Dr. Elisabeth Heyne, Susan Karlebowski, Dr. Omid Khorramshahi, Julia Tovote, Martin Tscholl;https://www.museumfuernaturkunde.berlin/en/research/human-nature-relationships-anthropocene
Berlin School of Public Engagement und Open Science;"The Berlin School connects people and research. We create incentives, opportunities, and competencies for collaboration between stakeholders, publics, and researchers at all career levels. To this end, the Berlin School offers training and consultancy for researchers at all career levels in research institutions worldwide, and to Public Engagement professionals in Germany, to build capacity and competence for Public Engagement and participation with research.
Our offers include:";Public Engagement and Impact, Research, Transfer, Open Museum, Future Plan, Knowledge Transfer, Science Communication, Society, Cooperation;;https://www.museumfuernaturkunde.berlin/en/research/berlin-school-public-engagement-und-open-science
European Citizen Science;Citizen Science;Social Innovation Unit, Science Communication, Citizen Science, Open Science;Silke Voigt-Heucke, Marius Oesterheld;https://www.museumfuernaturkunde.berlin/en/research/european-citizen-science
IETI - Impact-oriented Public Engagement;To face upcoming global, environmental and societal challenges we need to create impactful exchange and interactions between science and society. IETI - Impact-oriented Public Engagement - aims to increase the quality and efficiency of the Museum für Naturkunde Berlin’s Public Engagement, thus contributing to its academic, societal and environmental impact.;Public Engagement and Impact, Research, Transfer, Open Museum, Future Plan, Politics, Knowledge Transfer, Science Communication, Citizen Science, Society;Dr. Alina Loth, Dr. Zinaida Vasilyeva, Konstanza Jochim, Luise Proske, Dr. Ana Faustino, Zinaida Vasilyeva;https://www.museumfuernaturkunde.berlin/en/research/ieti-impact-oriented-public-engagement
Research for wild bees - designing community gardens together;Gardening for diversity. We explore how community gardens can promote pollinator diversity and provide tips for practice.;SP3 Society and Nature, Social Innovation Unit, Research, Knowledge Transfer, Science Communication, Protection of Species, Extinction of Species, Biodiversity, Citizen Science, Society, Cooperation;Ulrike Sturm, Susan Karlebowski;https://www.museumfuernaturkunde.berlin/en/research/research-wild-bees-designing-community-gardens-together
Acoustic Forest Monitoring;Forest monitoring is an important approach to maintaining and enhancing the state of forests. For this purpose, various methods are employed to evaluate the ecological, economic, and social functions of forests and to monitor changes in ecosystems. To ensure effective monitoring, it is essential to comprehensively record all relevant aspects of biodiversity in the forest. One promising method for surveying species that produce sounds is the use of (bio)acoustic methods.;Evolutionary Diversity Dynamics, Research;Dr. Karl-Heinz Frommolt, Dr. Olaf Jahn, Mario Lasseck, Benjamin Werner;https://www.museumfuernaturkunde.berlin/en/research/acoustic-forest-monitoring
Novel perspectives on our Solar System History recorded in the Atacama Desert (NoSHADE);In the interdisciplinary NoSHADE project funded by the European Research Council (ERC), Dr. Jenny Feige and her team are investigating the history of our solar system using sediments in the driest and oldest desert in the world, the Atacama Desert.;Solar System, Impacts & Meteorites, Research;Dr. Jenny Feige, Dr. Alessandro Airo, Dr. Christof Sager, Dr. Jenny Feige;https://www.museumfuernaturkunde.berlin/en/research/novel-perspectives-our-solar-system-history-recorded-atacama-desert-noshade
Public Engagement with Planetary Health with Focus on Food and Nutrition;The DBU-funded project ‘Planetary Health - Public Engagement with Planetary Health’ opens up new ways for a sustainable transformation of our food systems and consumption behaviour.;SP3 Society and Nature, Research, Knowledge Transfer, Science Communication, Society, Climate Change;Dr. Susanne Hecker;https://www.museumfuernaturkunde.berlin/en/research/public-engagement-planetary-health-focus-food-and-nutrition
Dominik Eulberg: Ambassador for nature;"Dominik Eulberg is a techno DJ, author, producer and biologist who has managed to combine his two lifelong passions - music and nature. A passionate conservationist, ornithologist and NABU bat ambassador, Dominik Eulberg is a guest scientist and ambassador ""for nature"" at the Museum für Naturkunde B";;Kim Mortega;https://www.museumfuernaturkunde.berlin/en/wissenschaft/dominik-eulberg-ein-botschafter-fuer-natur
Community-driven freshwater plastic monitoring in Western Africa;Monitoring Citizen Science water quality Africa;SP3 Society and Nature, Citizen Science;Dr. Sabrina Kirschke, Lea Schmidtke;https://www.museumfuernaturkunde.berlin/en/research/community-driven-freshwater-plastic-monitoring-western-africa
Virtual access to fossil and archival material from the German Tendaguru Expedition (1909-1913);Tendaguru: New Digitisation Project unites paleontological and archival data in one research environment;Evolutionary Morphology, SP2 Collection Future, SP3 Society and Nature, Research, Research Infrastructure, Knowledge Transfer, Digitalization, Fossils, Cultural Heritage;Dr. Daniela Schwarz, Dr. Ina Heumann, Dr. Verónica Díez Díaz, Marion Depraetere, Bernhard Schurian;https://www.museumfuernaturkunde.berlin/en/research/virtual-access-fossil-and-archival-material-german-tendaguru-expedition-1909-1913
Paleopathology in Late Triassic phytosaurs;The scientist Dr. Florian Witzmann studies the prehistoric diseases and injuries (paleopathology) of extinct phytosaurs to draw conclusions about their lifestyle and behaviour.;Evolutionary Morphology, Research, Fossils;PD Dr. Florian Witzmann;https://www.museumfuernaturkunde.berlin/en/research/paleopathology-late-triassic-phytosaurs
DMP4CS – Development of a tool for data management plans in citizen science;In the BMBF-funded project DMP4CS, a tool for creating data management plans in citizen science projects is being developed in cooperation with the German Aerospace Center (DLR).;SP3 Society and Nature, Social Innovation Unit, Transfer, Database, Research Data Management, Citizen Science, Cooperation;Ulrike Sturm, Susan Karlebowski;https://www.museumfuernaturkunde.berlin/en/research/dmp4cs-development-a-tool-data-management-plans-citizen-science
The diversity of thistle fruit flies;For decades, a loss of biodiversity has been observed all over the world. Extinction of species endangers the animal and plant community and, according to prognoses, could lead to a collapse of ecosystems worldwide. The interdependence of the animal and plant world is particularly evident on the example of insects. However, just one third of all insect species have been described, which means that a large number of them is threatened with extinction in the shadows. For this reason, the Ukrainian scientist Prof. Valery A.;Centre for Integrative Biodiversity Discovery, Research, Extinction of Species;;https://www.museumfuernaturkunde.berlin/en/research/diversity-thistle-fruit-flies
Wassernetz Berlin: Berlin nature conservation associations work together to protect urban water bodies;"The project ""Wassernetz Berlin"" is a civil society network in the field of water protection and biodiversity. The network was founded by the Berliner Landesarbeitsgemeinschaft Naturschutz e.V. as project promoter, BUND Berlin e.V., GRÜNE LIGA Berlin e.V., NABU Landesverband Berlin e.V., tip: tap e.V";SP3 Society and Nature;Julia Rostin, Silke Voigt-Heucke;https://www.museumfuernaturkunde.berlin/en/research/wassernetz-berlin-berlin-nature-conservation-associations-work-together-protect-urban
Development of a Citizen Science Center for Nature, Sustainability and Digitalization;The Citizen Science Center aims to link Citizen Science for nature, sustainability and digitalization together, involving stakeholders from politics, science, society and economics;SP3 Society and Nature, Social Innovation Unit, Politics, Knowledge Transfer, Biodiversity, Citizen Science, Society, Digitalization;Silke Voigt-Heucke, Susanne Hecker, Sophie Ewert (research assistant), Sophie Ewert;https://www.museumfuernaturkunde.berlin/en/research/development-a-citizen-science-center-nature-sustainability-and-digitalization
From collisions to impacts – the late growth history of Terrestrial Planets;The researchers of this multidisciplinary TRR170 project are interested in the late accretion onto terrestrial planets.;SP1 Dynamics of Nature, Solar System, Impacts & Meteorites, Research;Prof. Dr. Kai Wünnemann;https://www.museumfuernaturkunde.berlin/en/research/collisions-impacts-late-growth-history-terrestrial-planets
Virtual Wikidata edit-a-thon globally connects GLAM professionals and citizen scientists;Open, participatory approach to improve networking of researchers at the Museum für Naturkunde with actors from other GLAM institutions;SP2 Collection Future, Research Infrastructure, Open Museum, Collections Management, Database, Knowledge Transfer, Research Data Management, Citizen Science, Open Science, Digitalization, Cooperation, Cultural Heritage;Dr. Sabine von Mering, Erik Stolze;https://www.museumfuernaturkunde.berlin/en/research/virtual-wikidata-edit-a-thon-globally-connects-glam-professionals-and-citizen-scientists
Dunlop Lab;Jason Dunlop's research group studies fossil arachnids and their relatives, with a particular focus on evolution and biogeographical history.;SP1 Dynamics of Nature, Evolutionary Morphology, Research, Morphology, Evolution;Dr. Jason A. Dunlop;https://www.museumfuernaturkunde.berlin/en/research/dunlop-lab
Palaeobotany Lab;Research Topic;SP1 Dynamics of Nature, Evolutionary Diversity Dynamics, Research, Biodiversity, Evolution;Dr. Eva-Maria Sadowski, Simon Beurel, Melanie Diebert, Dr. Ludwig Luthardt;https://www.museumfuernaturkunde.berlin/en/research/palaeobotany-lab
Netzwerk Naturwissen;"The Museum für Naturkunde with its ""Netzwerk Naturwissen"" (Network of Nature Knowledge) is the venue for a collaboration with partners from Berlin and Brandenburg.";SP3 Society and Nature, Open Museum, Future Plan, Knowledge Transfer, Extinction of Species, Biodiversity, Cooperation;Carolin Glahe, Sylvana Jahre, Julia Diekämper;https://www.museumfuernaturkunde.berlin/en/research/netzwerk-naturwissen
MultiplEye Lab;The MultiplEye Lab research group studies the evolution of animals that have more than two eyes, such as spiders and snails.;SP1 Dynamics of Nature, Evolutionary Morphology, Research, Morphology, Evolution;Dr. Lauren Sumner-Rooney;https://www.museumfuernaturkunde.berlin/en/research/multipleye-lab
Open Wikidata edit-a-thon on colonial collection agents;Second Edit-a-thon at Museum für Naturkunde opens to a broader public;SP2 Collection Future, Research Infrastructure, Open Museum, Collections Management, Research Data Management, Citizen Science, Open Science, Digitalization, Cooperation;Sabine von Mering, Erik Stolze;https://www.museumfuernaturkunde.berlin/en/research/open-wikidata-edit-a-thon-colonial-collection-agents
New format of knowledge networking tested for the first time at the Museum;First in-house Edit-a-thon confirms need confirms demand from employees for participatory workshops;SP2 Collection Future, Open Museum, Collections Management, Research Data Management, Citizen Science, Open Science, Digitalization;Dr. Sabine von Mering, Erik Stolze;https://www.museumfuernaturkunde.berlin/en/research/new-format-knowledge-networking-tested-first-time-museum
In search of the processes and forces behind the evolution of the skull in early terrestrial vertebrates;The different environments of terrestrial vertebrates over time have led to a great diversity in the structure and shape of skulls. Scientists of the Museum für Naturkunde Berlin describe and analyze these differences within the framework of the project.;SP1 Dynamics of Nature, Evolutionary Morphology, Research, Morphology, Evolution, Fossils;Dr. Marylene Danto, Marylene Danto;https://www.museumfuernaturkunde.berlin/en/research/search-processes-and-forces-behind-evolution-skull-early-terrestrial-vertebrates
Collector edit-a-thons at the Museum für Naturkunde - developing innovative formats for participatory knowledge networking;Contribution to international collection networking: The opening of internal data on collectors to the general public - using open and participatory digital formats such as Wikidata - opens up a wide range of new, unexpected opportunities for cooperation.;SP2 Collection Future, Open Museum, Collections Management, Research Data Management, Collection, Citizen Science, Open Science, Cooperation;Dr. Sabine von Mering, Erik Stolze;https://www.museumfuernaturkunde.berlin/en/research/collector-edit-a-thons-museum-fur-naturkunde-developing-innovative-formats-participatory
"""Opportunities and limitations of participation in academia""";"A conference in the context of the "" Wissenschaftsjahr Nachgefragt!"" - 26.09.2022 at the Museum für Naturkunde Berlin";Social Innovation Unit, Research, Transfer, Open Museum, Knowledge Transfer, Society;;https://www.museumfuernaturkunde.berlin/en/research/opportunities-and-limitations-participation-academia
Moving monoliths: Analyzing the stance and locomotion of sauropod dinosaurs;Herbivorous dinosaurs were the largest land-dwelling animals to ever inhabit the Earth. Despite extensive research, it is still unclear how these gigantic dinosaurs were able to move. Scientists at the museum are now investigating this question.;SP1 Dynamics of Nature, Evolutionary Morphology, Research, Morphology, Evolution, Fossils;Dr. Verónica Díez Díaz;https://www.museumfuernaturkunde.berlin/en/research/moving-monoliths-analyzing-stance-and-locomotion-sauropod-dinosaurs
Planetary Defense: Deflecting dangerous asteroids;The goal of the mission, led by NASA and ESA, is to provide scientific evidence for the possibility of deflection of an asteroid by external impact. Scientists from the Museum für Naturkunde Berlin are part of the international team.;SP1 Dynamics of Nature, Solar System, Impacts & Meteorites, Research, Impact;Prof. Dr. Kai Wünnemann, Dr. Robert Luther;https://www.museumfuernaturkunde.berlin/en/research/planetary-defense-deflecting-dangerous-asteroids
Do large mammals have smaller and simpler brains on islands?;Within the framework of the project, scientists from the Museum für Naturkunde Berlin will analyze in more detail how the brains of island-dwelling mammals have changed over time and which factors have played a role in this.;SP1 Dynamics of Nature, Evolutionary Morphology, Research, Morphology, Mammals, Evolution, Fossils;Dr. Roberto Rozzi;https://www.museumfuernaturkunde.berlin/en/research/do-large-mammals-have-smaller-and-simpler-brains-islands
What we’re doing in the Collection Discovery and Development project;Wir stellen uns der Verantwortung, unsere Sammlung zu bewahren, zu öffnen und für alle zugänglich zu machen. Dabei vernetzen wir Wissen und entwickeln unser Sammlungsmanagement sowie Services und Infrastrukturen ständig weiter.;SP2 Collection Future, Research, Transfer, Open Museum, Future Plan, Politics, Knowledge Transfer, Science Communication, Collection, Society, Digitalization;Dr. Mareike Petersen, Dr. Frederik Berger, Dr. Anke Hoffmann;https://www.museumfuernaturkunde.berlin/en/research/what-were-doing-collection-discovery-and-development-project
Pollinator Pathmaker: A living artwork for pollinators;Pollinator Pathmaker is a living artwork that invites schools and the public to look at the world from the viewpoint of pollinating insects and help to protect them.;SP3 Society and Nature, Social Innovation Unit, Open Museum, Protection of Species, Citizen Science, Cooperation;Dr. Kim Geraldine Mortega;https://www.museumfuernaturkunde.berlin/en/research/pollinator-pathmaker-a-living-artwork-pollinators
Amniota Lab;The Amniota Lab research group concentrates on fossil and terrestrial vertebrates, particularly lizards and snakes, as well as mammalian herbivores. A particular interest lies in the causes of evolutionary diversification and the causes that lead to the evolution of different species.;SP1 Dynamics of Nature, Evolutionary Diversity Dynamics, Evolutionary Morphology, Research, Morphology, Mammals, Evolution, Fossils, Earth Sciences;PD Dr. Faysal Bibi, Prof. Dr. Johannes Müller, Roberto Rozzi, Fernando Blanco, Kristin Mahlow, Faysal Bibi, Antonia Kaffler;https://www.museumfuernaturkunde.berlin/en/research/amniota-lab
Live Science;New forms of interpersonal communication in museum spaces (NuForm) - Live Science;SP3 Society and Nature, Exhibition, Research, Open Museum, Knowledge Transfer, Digitalization;Linda Gallé, Uwe Moldrzyk, Dr. Claire Förster, Nadine Kühne;https://www.museumfuernaturkunde.berlin/en/research/live-science
The Mineral Dance;New forms of interpersonal communication in museum spaces (NuForm) - The Mineral Dance;SP3 Society and Nature, Exhibition, Research, Open Museum, Knowledge Transfer, Digitalization;Linda Gallé, Uwe Moldrzyk, Dr. Claire Förster, Nadine Kühne;https://www.museumfuernaturkunde.berlin/en/research/mineral-dance
The 360°Guided Tour;New forms of interpersonal communication in museum spaces (NuForm) - The 360°Guided Tour;SP3 Society and Nature, Exhibition, Research, Open Museum, Knowledge Transfer, Digitalization;Dr. Claire Förster, Linda Gallé, Uwe Moldrzyk, Dr. Claire Förster, Nadine Kühne;https://www.museumfuernaturkunde.berlin/en/research/360degguided-tour
On your marks! Citizen Science in your city;Doing research collectively, discovering new things and actively shaping the discourse between science and society. Citizen Science encompasses all this and more. The contest promotes the idea of Citizen Science as a tangible and local action.;SP3 Society and Nature, Research, Knowledge Transfer, Citizen Science, Open Science, Society;Gesine Heinrich;https://www.museumfuernaturkunde.berlin/en/research/your-marks-citizen-science-your-city
Provenance research under the spotlight;Provenance research under the spotlight: the Digital Edition of the Annual Reports of the Museum 1887-1915 and 1928-1938;SP2 Collection Future, Research, Research Infrastructure, Transfer, Database, Collection, Digitalization;Ina Heumann, Katja Kaiser, Elisa Herrmann;https://www.museumfuernaturkunde.berlin/en/research/provenance-research-under-spotlight
Experimental Field for Participation and Open Science;The Experimental Field tests various formats of research communication and participation.;Exhibition, Research, Science Communication, Open Science;;https://www.museumfuernaturkunde.berlin/en/research/experimental-field-participation-and-open-science
The EU-Citizen.Science project;The EU-Citizen.Science platform is the knowledge platform for Citizen Science in Europe.;SP3 Society and Nature, Research, Knowledge Transfer, Citizen Science, Society;Silke Voigt-Heucke, Dr. Antonella Radicchi;https://www.museumfuernaturkunde.berlin/en/research/eu-citizen.science-project
Civic Digitization;Civic Digitization ethnographically discovers the process of digitization.;SP2 Collection Future, Research, Open Museum, Science Communication, Collection, Digitalization;Prof. Dr. Tahani Nadim;https://www.museumfuernaturkunde.berlin/en/research/civic-digitization
Museums and Society: Mapping the Social;Museums and Society discovers the social role of museums as places of knowledge exchange and community building.;SP2 Collection Future, Research, Society;Prof. Dr. Tahani Nadim;https://www.museumfuernaturkunde.berlin/en/research/museums-and-society-mapping-social
Our Research Clusters;The museum presents its six new research clusters;Research Cluster;Dr. Anke Hoffmann;https://www.museumfuernaturkunde.berlin/en/research/our-research-clusters
Center for the Humanities of Nature;The Center for the Humanities of Nature brings together scholars and practitioners from the history of science, science and technology studies, the sociology of science and sustainability, cultural studies, museum studies and the arts. They focus on the politics, histories and cultures of nature through original research and public engagements in the field of knowledge transfer.;SP2 Collection Future;Anita Hermannstädter, Dr. Ina Heumann, Dr. Katja Kaiser, Dr. Catarina Madruga, Prof. Dr. Michael Ohl, Dr. Angela Strauß, Sarina Schirmer, Katja Kaiser;https://www.museumfuernaturkunde.berlin/en/research/center-humanities-nature
Collection Development;The Collection Development looks at safeguarding and developing the Museum’s comprehensive collections in the long term in the best possible way. On the basis of a professional, scientifically supported collection management that complies with international standards, the collections are being developed as a globally available infrastructure that will meet the present and future needs of science and society.;SP2 Collection Future, Collection;Dr. Christiane Quaisser;https://www.museumfuernaturkunde.berlin/en/research/collection-development
